{
  "schemaVersion": "1",
  "generatedAtUtc": "2026-08-05T19:12:05.2970982+00:00",
  "tool": {
    "name": "fallen-8-bench",
    "version": "1.0.0.0"
  },
  "source": {
    "engineVersion": "0.3.0.0",
    "commit": "75048997f6aeecb662367949e00415c25bfd32ec",
    "dirtyWorkingTree": false
  },
  "environment": {
    "operatingSystem": "Microsoft Windows 10.0.26200",
    "architecture": "X64",
    "runtime": ".NET 10.0.10",
    "processorCount": 32,
    "processorName": "AMD Ryzen 9 5950X 16-Core Processor",
    "totalPhysicalMemoryMb": 65442,
    "serverGarbageCollection": true,
    "concurrentGarbageCollection": true,
    "runnerLabel": "Ryzen"
  },
  "profile": "full",
  "metrics": {
    "memory": [
      {
        "label": "degree 2",
        "vertices": 2000000,
        "edges": 4000000,
        "averageDegree": 2,
        "bytesPerVertex": 88,
        "bytesPerEdge": 171.8,
        "retainedMb": 823.1
      },
      {
        "label": "degree 10",
        "vertices": 10000000,
        "edges": 100000000,
        "averageDegree": 10,
        "bytesPerVertex": 88,
        "bytesPerEdge": 121.3,
        "retainedMb": 12407.7
      },
      {
        "label": "degree 20",
        "vertices": 1000000,
        "edges": 20000000,
        "averageDegree": 20,
        "bytesPerVertex": 88,
        "bytesPerEdge": 114.1,
        "retainedMb": 2261.1
      }
    ],
    "writeThroughput": [
      {
        "label": "serial (1 producer)",
        "producers": 1,
        "writes": 11840,
        "writesPerSecond": 393,
        "walEnabled": true
      },
      {
        "label": "32 concurrent producers",
        "producers": 32,
        "writes": 200000,
        "writesPerSecond": 10138,
        "walEnabled": true
      }
    ],
    "saveStall": [
      {
        "elements": 1002000,
        "vertices": 334000,
        "edges": 668000,
        "writerHoldMs": 74.1
      },
      {
        "elements": 4002000,
        "vertices": 1334000,
        "edges": 2668000,
        "writerHoldMs": 447.8
      },
      {
        "elements": 20001000,
        "vertices": 6667000,
        "edges": 13334000,
        "writerHoldMs": 1139.3
      }
    ],
    "traversal": [
      {
        "label": "5M edges",
        "vertices": 500000,
        "edges": 5000000,
        "iterations": 5,
        "edgesPerSecond": 369847105
      },
      {
        "label": "20M edges",
        "vertices": 2000000,
        "edges": 20000000,
        "iterations": 5,
        "edgesPerSecond": 298700057
      },
      {
        "label": "100M edges",
        "vertices": 10000000,
        "edges": 100000000,
        "iterations": 5,
        "edgesPerSecond": 283051178
      }
    ]
  }
}
